{
  "$schema": "https://agent-fox.dev/schemas/requirements.v2.json",
  "spec_id": "02",
  "spec_name": "draft_feature",
  "schema_version": 2,
  "introduction": "The draft feature exercises a spec that is still in the draft lifecycle state.",
  "glossary": {
    "draft": "The lifecycle state a spec is in before its intent is hashed."
  },
  "requirements": [
    {
      "id": "02-REQ-1",
      "title": "Draft lifecycle",
      "rationale": "A draft must stay editable until its intent is agreed.",
      "criteria": [
        {
          "id": "02-REQ-1.1",
          "pattern": "state_driven",
          "condition": "a spec is in the draft state",
          "system": "afspec library",
          "action": "allow every field of the PRD to be edited and saved",
          "contract": "Save returns a nil error"
        },
        {
          "id": "02-REQ-1.2",
          "pattern": "unwanted",
          "condition": "a transition to a state outside the lifecycle graph is requested",
          "system": "afspec library",
          "action": "reject the transition and leave the spec unchanged",
          "contract": "a LifecycleError naming the current and target states"
        }
      ]
    }
  ],
  "execution_paths": [
    {
      "id": "02-PATH-1",
      "title": "An operator edits a draft spec",
      "steps": [
        {
          "actor": "operator",
          "action": "edits the Intent section of prd.md"
        },
        {
          "actor": "afspec library",
          "action": "saves the spec and leaves the intent hash null"
        }
      ]
    }
  ]
}
